Firefighters are battling a forest fire;Stra¿acy walcz¹ z po¿arem lasu 
Can we predict quakes? Czy mo¿emy przewidzieæ trzêsienia ziemi?;
Predict where and when a earthquake will occur;Przewidzieæ gdzie i kiedy nast¹pi trzêsienie ziemi 
Quake devastated the city;Trzêsienie ziemi zniszczy³o miasto 
There are aftershocks every 15 to 20 minutes;Wstrz¹sy wtórne wystêpuj¹ co 15-20 minut 
The first shock was really strong;Pierwszy wstrz¹s by³ naprawdê silny 
People were falling in the streets;Ludzie na ulicach upadali 
The ground began to shake;Ziemia zaczê³a siê trz¹œæ 
The epicentre was only 15 km from the centre of the capital;Epicentrum znajdowa³o siê tylko 15 km od centrum stolicy 
I saw buildings collapse;Widzia³em wal¹ce siê budynki 
The tremor was felt all over the country;Wstrz¹s by³ odczuwalny na terenie ca³ego kraju 
Rescue workers pulled a boy out of the rubble;Ratownicy wyci¹gnêli ch³opca spod gruzów 
Hundreds were stuck under rubble;Setki osób s¹ uwiêzione pod gruzami 
Earthquakes are common in Iran;Trzêsienia ziemi s¹ normalnym zjawiskiem w Iranie 
The earthquake caused buildings to sway;Budynki ko³ysa³y siê 
Heavy rains have triggered floods;Ulewne deszcze wywo³a³y powodzie
Fire crews spent the night pumping out the homes;Stra¿acy przez ca³¹ noc wypompowywali wodê z domów 
Major roads were flooded;G³ówne drogi zosta³y zalane 
More than 65000 people had to be evacuated;Ponad 65000 osób zosta³o ewakuowanych 
Water are starting to recede;Woda zaczê³a opadaæ 
Rivers burst their banks;Rzeki wyla³y z brzegów 
Water-level rose by four metres in three hours;Poziom wody wzrós³ o cztery metry w ci¹gu trzech godzin 
Army engineers blasted a 50m hole in a dyke;Saperzy wysadzili wa³ tworz¹c 50-metrow¹ wyrwê 
The floods subsided;Wody opad³y 
Journey to flood villages in Peru;Podró¿ do zalanych peruwiañskich wsi 
The bridge was swept away by the rains;Deszcze zmiot³y most 
The strength of the floods overturned cars;Wezbrana woda przewraca³a samochody 
Cars were washed away;Woda porwa³a samochody 
The fire was brought under control;Po¿ar wymkn¹³ siê spod kontroli 
More than 300 inmates were killed in a prison fire;Ponad 300 skazanych zginê³o w po¿arze wiêzienia 
The flames raged for about an hour;P³omienie szala³y przez oko³o godzinê 
Dozens of people had looted a supermarket;Dziesi¹tki ludzi rozszabrowa³y supermarket 
It was the strongest earthquake for more than 50 years;To by³o najsilniejsze trzêsienie ziemi od ponad 50 lat 
The earthquake was felt across the region;Trzêsienie ziemi by³o odczuwalne w ca³ym regionie 
Three people may be trapped in the rubble;Trzy osoby mog¹ byæ uwiêzione pod gruzami 
The sea was breaking over the beach;Morze wdar³o siê na pla¿ê 
The waters came up so high;Woda podesz³a wysoko 
The sun was down;S³oñce zasz³o 
The bay was smooth as glass;Zatoka by³a g³adka jak lustro 
The sun had risen again;S³oñce znów wsta³o 
It was about seven o'clock when we were at the top of the hill;Oko³o siódmej stanêliœmy na szczycie wzgórza 
In bed of river there were pebbles and boulders;W ³o¿ysku rzeki le¿a³y kamienie i g³azy 
The fields were green;Pola by³y zielone 
Close to the bank I saw deep pools;Przy brzegu widzia³em g³êbokie sadzawki 
On both sides of us stretched plain;Po obu stronach rozpoœciera³a siê równina 
The mulberry trees were bare and the fields were brown;Drzewa morwowe sta³y nagie a pola by³y bure 
The road went up the valley a long way;Droga przez d³u¿szy czas bieg³a dolin¹ 
The sun had set;S³oñce ju¿ zasz³o 
There was a little fog in the air;W powietrzu rozsnu³a siê mg³a 
All night long the tempest grew fiercer;Przez ca³¹ noc sztorm przybiera³ na sile 
The wind blew fiercest about five in the morning;Wiatr d¹³ najsilniej oko³o pi¹tej rano 
The storm did a lot of damage;Burza wyrz¹dzi³a du¿o szkód 
The wind became stronger;Wiatr nabra³ na sile 
The wind blew the smoke away;Wiatr odwia³ dym 
The days were lengthening fast;Dnia szybko przybywa³o 
The morning was bright enough;Ranek by³ pogodny 
There was not the feeling of a storm coming;Nie czu³o siê ¿e nadci¹ga burza 
I saw a cloud coming over the mountain;Zauwa¿y³em chmurê wysuwaj¹c¹ siê zza gór 
The sun went a dull yellow;S³oñce po¿ó³k³o i zmatowia³o 
Sky was covered;Niebo siê zaci¹gnê³o 
It was warm and like the spring;By³o ciep³o i wiosennie 
I saw the sun coming through the window;Zobaczy³em s³oñce wpadaj¹ce przez okno 
Outside the window it was a lovely spring morning;Na dworze by³ piêkny wiosenny poranek 
It had been raining in the mountains;W górach pada³y deszcze 
It was cold and the drops hung to the branches;By³o zimno i krople zwisa³y z ga³êzi 
It was starting to rain again;Znowu zaczê³o padaæ 
The night was getting cold;Noc robi³a siê ch³odna 
The rain had stopped falling;Deszcz przesta³ padaæ 
The rain was slacking;Deszcz ustawa³ 
The sky had clouded over again;Niebo znowu siê zachmurzy³o 
The sun was almost out from behind the clouds;S³oñce ju¿ prawie wysz³o zza chmur 
The sun was going down and the day was cooling off;S³oñce ju¿ zachodzi³o i robi³o siê ch³odniej 
The wind drove down the rain;Wiatr zacina³ deszczem 
The wind rose in the night;W nocy zerwa³ siê wiatr 
They were wet to the skin and all were scared;Wszyscy byli przemoczeni do suchej nitki i wystraszeni 
What kind of tree is this? ;Co to za drzewo?
She climbed up a tree;Wspiê³a siê na drzewo 
The trees were green with buds;Drzewa zieleni³y siê ju¿ p¹kami
Trunks of trees were dusty;Pnie drzew pokryte by³y kurzem 
Leaves fell early that year;Liœcie opada³y wczeœnie tego roku 
Forest of oak trees;Las dêbowy 
The trees along the road had small leaves;Drzewa rosn¹ce wokó³ drogi wypuœci³y ma³e listki 
The trees were dripping in the rain;Drzewa ocieka³y wod¹ 
The wind blew the leaves;Wiatr porusza³ liœæmi 
There was a mist in the trees;Drzewa by³y spowite mg³¹ 
There were trees along both sides of the road;Po obu stronach drogi ros³y drzewa 
There were wet dead leaves on the road;Na drodze le¿a³y mokre zwiêd³e liœcie 
The evening wore on;Wieczór mija 
I will time you;Zmierzê ci czas 
All in good time;Wszystko w swoim czasie 
Race against time;Wyœcig z czasem 
Time is money;Czas to pieni¹dz 
Time is up;Czas min¹³ 
He's ahead of his times;Wyprzedzi³ swoj¹ epokê 
Shortly before nine o'clock;Tu¿ przed dziewi¹t¹ 
Many years passed;Minê³o wiele lat 
No one knows when the first calendar was developed;Nikt nie wie kiedy stworzono pierwszy kalendarz 
We remember the past;Pamiêtamy przesz³oœæ 
We do not know the future;Nie znamy przysz³oœci 
There's a time and a place for everything;Wszystko ma swój czas i miejsce 
Why this day of all others?;Dlaczego akurat dzisiaj?
It has turned two o'clock;Minê³a druga godzina 
It was past one;By³o po pierwszej 
It's coming up to ten o'clock;Zbli¿a siê godzina dziesi¹ta 
Don't wait any longer;Nie czekaj ju¿ d³u¿ej 
He was born at the turn of the century;Urodzi³ siê na prze³omie wieków 
He was here just now;Przed chwil¹ tutaj by³ 
The future is dark;Przysz³oœæ maluje siê w ciemnych barwach 
We knew it was all over for that year;Wiedzieliœmy ¿e to ju¿ koniec na ten rok 
Several hours later;Kilka godzin póŸniej 
That takes more time;Na to trzeba wiêcej czasu 
It must have been late in October;Musia³ to byæ koniec paŸdziernika 
I have forgotten the exact date;Nie pamiêtam dok³adnej daty 
In a minute there were none left in the church;W jednej chwili koœció³ opustosza³ 
It must have been past four o'clock in the afternoon;Musia³o byæ ju¿ po szesnastej 
The clock in the tower struck midnight;Zegar na wie¿y wybi³ pó³noc 
One evening in March;Pewnego marcowego wieczoru 
Once in five years;Raz na piêæ lat 
A few minutes more;Jeszcze kilka minut 
We had not long to wait;Nie musieliœmy d³ugo czekaæ 
All around the place;Wszêdzie dooko³a 
Near the border with Canada;W pobli¿u granicy z Kanad¹ 
It's broader by a metre;Jest szerszy o metr 
The village of Moonfleet lies half a mile from the sea;Wieœ Moonflet le¿y pó³ mili od morza 
On the right or west bank of the Fleet stream;Na prawym czyli zachodnim brzegu rzeczki Fleet 
The passage was two paces broad;Korytarz mia³ dwa kroki szerokoœci 
She paced out the distance;Krokami odmierzy³a odleg³oœæ 
He lay there motionless;Le¿a³ tam bez ruchu 
She rushed by me;Przemknê³a obok mnie 
They ran back;Pobiegli z powrotem 
He walked away slowly;Odszed³ powoli 
We walked for miles;Szliœmy wiele mil 
The priest shook his head and went on;Kapelan pokrêci³ g³ow¹ i ruszy³ dalej 
He folded his hands over his knee;Zaplót³ rêce na kolanie 
I went along the narrow road down toward the river;Pojecha³em w¹sk¹ drog¹ ku rzece
I don’t think we are going far;Myœlê ¿e nie zajedziemy daleko 
They both started to run;Obaj zaczêli biec 
We went up the ladder;Weszliœmy na górê po drabinie 
We were walking fast;Szliœmy szybko 
I was off across the meadows towards the church;Ruszy³em przez ³¹ki w stronê koœcio³a 
He gave himself a little strut in walking;Chodz¹c unosi³ siê na palcach 
She could beat most of us boys at speed;Biega³a szybciej ni¿ wielu ch³opców
In the still of night;W ciszy nocy 
Some of the wounded were noisy but most were quiet;Niektórzy ranni krzyczeli ale wiêkszoœæ by³a cicho 
I heard a rumbling and crumbling;Us³ysza³em szmery i ³oskoty 
The grass sounded crisp under my feet;Trawa trzeszcza³a pod moimi stopami 
The awful stillness of the vault was broken;Przera¿aj¹ca cisza krypty zosta³a zak³ócona 
I could hear a murmur of distant voices;S³ysza³em szmer oddalaj¹cych siê g³osów 
The echo of my own voice;Echo mojego w³asnego g³osu 
The silence palled upon me;Nie mog³em wytrzymaæ tej drêcz¹cej ciszy 
All was still so that one heard the browsing horses;Panowa³a cisza s³ychaæ by³o tylko chrobotanie koni 
He has became pale;Zblad³ 
The deep blue of the night given way to a misty grey;Ciemny granat nocy sta³ siê mglisto szary 
The night was greyer;Noc ju¿ poszarza³a 
All were of one pearly grey colour;Wszystko by³o per³owoszare 
It is already dark;Ju¿ jest ciemno 
It's getting dark;Œciemnia siê 
Let there be light;Niech rozb³yœnie œwiat³o 
The sunshine came streaming into the room;Promienie s³oñca wpada³y do pokoju 
The light showed through the door;Œwiat³o przedziera³o siê przez drzwi 
The light was fading;Œciemnia³o siê 
There was a shadow from his hand on the wall;Cieñ jego rêki pad³ na œcianê 
I saw the sun coming through the window;Zobaczy³em s³oñce wpadaj¹ce przez okno 
It was dark outside;Na dworze by³o ciemno 
It was nearly dark;By³o ju¿ prawie ciemno 
Outside it was getting dark;Na dworze zmierzcha³o siê 
The moon shone very brightly on the lagoon;Ksiê¿yc bardzo jasno b³yszczy na lagunie 
The light began to fail;Zapada³ zmierzch 
The darkness grew;Mrok zgêstnia³ 
I saw from the red glow behind the curtains;Dostrzeg³em czerwony odblask na zas³onach 
I saw a blue flare in the bows;Ujrza³em b³ysk niebieskiego œwiat³a na dziobie ³odzi 
I had put out the candle;Zgasi³em œwiecê 
The candle flickered;Œwieca zamigota³a 
I could see the faintest line of light;Dojrza³em cieniutk¹ liniê œwiat³a 
The sun was setting for another night;S³oñce zachodzi na nastêpn¹ noc 
The glimmering streak of light had faded;Smu¿ka jasnoœci poblad³a 
The awful blackness was creeping up again;Znów siê wkrada straszliwy mrok 
It was getting dusk;Zapada³ zmierzch 
The flame grew pale and paler;P³omieñ blad³ coraz bardziej 
The candle burnt low;Œwieca ju¿ siê dopala³a 
